mysql> delimiter //
mysql> create trigger emp_insert
    -> before insert on employee
    -> for each row
    -> if
    -> new.salary>70000 then set new.salary=0;
    -> end if;
    -> end //
Query OK, 0 rows affected (0.01 sec)

ERROR 1064 (42000): You have an error in your SQL syntax; check the manual that corresponds to your MySQL server version for the right syntax to use near 'end' at line 1
mysql> insert into employee values(8,'kiran',46,'narasaraopet',60000);
    -> end//
Query OK, 1 row affected (0.01 sec)

ERROR 1064 (42000): You have an error in your SQL syntax; check the manual that corresponds to your MySQL server version for the right syntax to use near 'end' at line 1
mysql> select *from employee;
    -> end //
+------+----------+------+----------------+--------+
| e_id | emp_name | age  | address        | salary |
+------+----------+------+----------------+--------+
|    1 | sammer   |   24 | chilakaluripet |  28888 |
|    2 | ramesh   |   28 | edlapadu       |  78955 |
|    3 | sasi     |   37 | timmapuram     |  38888 |
|    4 | jaswanth |   45 | pedanandipadu  | 100000 |
|    5 | ram      |   34 | avadi          |  43636 |
|    5 | komma    |   46 | karuchola      |  80000 |
|    6 | sunder   |   35 | nadendla       |  60987 |
|    7 | tanniru  |   26 | pondi          |  89000 |
|    8 | sun      |   39 | koturu         |  70987 |
|    8 | kiran    |   46 | narasaraopet   |  60000 |
|    8 | kiran    |   46 | narasaraopet   |  60000 |
|    8 | kiran    |   46 | narasaraopet   |  60000 |
|    8 | kiran    |   46 | narasaraopet   |  60000 |
|    8 | kiran    |   46 | narasaraopet   |  60000 |
+------+----------+------+----------------+--------+
14 rows in set (0.00 sec)

ERROR 1064 (42000): You have an error in your SQL syntax; check the manual that corresponds to your MySQL server version for the right syntax to use near 'end' at line 1
mysql> insert into employee values(9,'kabir',47,'srikakulam',80000);
    -> end //
Query OK, 1 row affected (0.00 sec)

ERROR 1064 (42000): You have an error in your SQL syntax; check the manual that corresponds to your MySQL server version for the right syntax to use near 'end' at line 1
mysql> select *from employee;
    -> end //
+------+----------+------+----------------+--------+
| e_id | emp_name | age  | address        | salary |
+------+----------+------+----------------+--------+
|    1 | sammer   |   24 | chilakaluripet |  28888 |
|    2 | ramesh   |   28 | edlapadu       |  78955 |
|    3 | sasi     |   37 | timmapuram     |  38888 |
|    4 | jaswanth |   45 | pedanandipadu  | 100000 |
|    5 | ram      |   34 | avadi          |  43636 |
|    5 | komma    |   46 | karuchola      |  80000 |
|    6 | sunder   |   35 | nadendla       |  60987 |
|    7 | tanniru  |   26 | pondi          |  89000 |
|    8 | sun      |   39 | koturu         |  70987 |
|    8 | kiran    |   46 | narasaraopet   |  60000 |
|    8 | kiran    |   46 | narasaraopet   |  60000 |
|    8 | kiran    |   46 | narasaraopet   |  60000 |
|    8 | kiran    |   46 | narasaraopet   |  60000 |
|    8 | kiran    |   46 | narasaraopet   |  60000 |
|    9 | kabir    |   47 | srikakulam     |      0 |
+------+----------+------+----------------+--------+
15 rows in set (0.00 sec)
mysql> delimiter //
mysql> create trigger empl_insert
    -> after insert on employee
    -> for each row
    -> begin
    -> if new.e_id >20 then
    -> insert into new_employee values(new.e_id,new.emp_name,new.age,new.address,new.salary);
    -> end if;
    -> end //
Query OK, 0 rows affected (0.02 sec)
mysql> select *from new_employee;
    -> end //
+------+----------+------+-----------+--------+
| e_id | emp_name | age  | address   | salary |
+------+----------+------+-----------+--------+
|   21 | balaji   |   43 | tirupathi |  45000 |
+------+----------+------+-----------+--------+
mysql>  delimiter //
mysql>  create trigger stu_student
    ->  before update on student
    ->      for each row
    ->      begin
    ->      if new.age>30 then
    ->      set new.age=29;
    ->      elseif new.age<30 then
    ->      set new.age=25;
    ->      end if;
    ->     end //
Query OK, 0 rows affected (0.01 sec)

mysql> select *from student;
    -> end//
+------+----------+------+----------------+-----------+
| s_id | stu_name | age  | address        | mobile_no |
+------+----------+------+----------------+-----------+
|    1 | sammer   |   24 | chilakaluripet |   2888856 |
|    3 | sasi     |   37 | timmapuram     |   3884388 |
|    4 | jaswanth |   45 | pedanandipadu  |  12400000 |
|    5 | ram      |   34 | avadi          |   4325636 |
|    2 | ramesh   |   26 | edlapadu       | 748393939 |
| NULL | komma    |   23 | eluru          |   6388279 |
+------+----------+------+----------------+-----------+
6 rows in set (0.00 sec)

ERROR 1064 (42000): You have an error in your SQL syntax; check the manual that corresponds to your MySQL server version for the right syntax to use near 'end' at line 1
mysql> update student set age=45 where s_id = 4;
    -> end //
Query OK, 1 row affected (0.00 sec)
Rows matched: 1  Changed: 1  Warnings: 0

ERROR 1064 (42000): You have an error in your SQL syntax; check the manual that corresponds to your MySQL server version for the right syntax to use near 'end' at line 1
mysql> select *from student;
    -> end //
+------+----------+------+----------------+-----------+
| s_id | stu_name | age  | address        | mobile_no |
+------+----------+------+----------------+-----------+
|    1 | sammer   |   24 | chilakaluripet |   2888856 |
|    3 | sasi     |   37 | timmapuram     |   3884388 |
|    4 | jaswanth |   29 | pedanandipadu  |  12400000 |
|    5 | ram      |   34 | avadi          |   4325636 |
|    2 | ramesh   |   26 | edlapadu       | 748393939 |
| NULL | komma    |   23 | eluru          |   6388279 |
+------+----------+------+----------------+-----------+
6 rows in set (0.00 sec)